{
  "title": "lookup",
  "type": "lookup",
  "description": "lookup a value in another dataframe and add as column",
  "color": "orange",
  "icon": "call_merge",
  "inputs": [
    { "id": "df", "label": "df", "type": "dataframe" },
    { "id": "df_lookup", "label": "lookup dataframe", "type": "dataframe" }
  ],
  "outputs": [{ "id": "df", "label": "df", "type": "dataframe" }],
  "comment_template": "lookup {{props.column}}"
}
