{
  "title": "aggregate",
  "type": "aggregate",
  "description": "groupby",
  "color": "orange",
  "icon": "call_merge",
  "inputs": [
    {
      "id": "df",
      "label": "df",
      "type": "dataframe"
    }
  ],
  "outputs": [
    {
      "id": "df",
      "label": "df",
      "type": "dataframe"
    }
  ],
  "comment_template": "aggregate by {{#each props.groupBy}}{{this.name}} {{/each}}"
}
